<!ELEMENT CONTACTLIST (CONTACT+)>
<!ELEMENT CONTACT (NAME, ADDRESS?, PHONE*, MAIL)>
<!ELEMENT NAME (#PCDATA)>
<!ELEMENT ADDRESS (#PCDATA)>
<!ELEMENT PHONE (#PCDATA)>
<!ELEMENT MAIL (#PCDATA)>

<!ATTLIST PHONE type CDATA #REQUIRED>